{
  "$schema": "http://json-schema.org/draft-07/schema#",
  "$id": "https://freshlybaked.us/lp/schemas/bundle.v1.schema.json",
  "title": "Landing-page bundle content (bundle.json) v1",
  "description": "Per-site config (migrated sites.yaml), per-family X1-X5 stacks + slot requirements, and the frozen-component contracts (parent EPIC_PLAN §5). Detailed leaf shapes (site config, component props) are intentionally open pending the P1/P2 migration of mss sites.yaml and component contracts; the skeleton here is the frozen interface.",
  "type": "object",
  "additionalProperties": false,
  "required": ["schema", "bundle_id", "sites", "families", "components"],
  "properties": {
    "schema": { "const": "freshlybaked.lp.bundle.v1" },
    "bundle_id": {
      "type": "string",
      "pattern": "^lpb_[0-9]{4}-[0-9]{2}-[0-9]{2}_[0-9]{6}_[0-9a-f]{6}$"
    },
    "sites": {
      "type": "object",
      "description": "Keyed by canonical SITE id (migrated from mss sites.yaml; Helios is source of truth per decision 3).",
      "minProperties": 1,
      "additionalProperties": { "$ref": "#/definitions/site" }
    },
    "families": {
      "type": "object",
      "description": "Keyed by family id (e.g. 'weed-delivery-near-me'); the X1-X5 stack and per-slot requirements.",
      "minProperties": 1,
      "additionalProperties": { "$ref": "#/definitions/family" }
    },
    "components": {
      "type": "object",
      "description": "Frozen component contracts, including the X2 trust-anchor (cash/debit). Keyed by component id.",
      "additionalProperties": { "$ref": "#/definitions/component" }
    }
  },
  "definitions": {
    "site": {
      "type": "object",
      "description": "Per-site config migrated from sites.yaml. Shape is open in P0; pinned during P1 sites.jsonc migration.",
      "required": ["purpose_max_variant"],
      "properties": {
        "host": { "type": "string", "description": "Public host, e.g. midtown.freshlybaked.us" },
        "purpose_max_variant": {
          "type": "object",
          "description": "Mirror of the mss-owned MAX_VARIANT_BY_PURPOSE drift-guard: PURPOSE -> highest valid NUM. The compiler validates policy/kill-list NUMs against this.",
          "additionalProperties": { "type": "integer", "minimum": 1 }
        }
      },
      "additionalProperties": true
    },
    "family": {
      "type": "object",
      "additionalProperties": false,
      "required": ["purpose", "slots"],
      "properties": {
        "purpose": { "type": "string", "description": "Canonical PURPOSE this family renders under (e.g. deliverance, compare)." },
        "slots": {
          "type": "array",
          "description": "Ordered X-slot ids that make up this family's stack (e.g. ['X1','X2','X3','X4','X5']).",
          "minItems": 1,
          "items": { "$ref": "#/definitions/slot_id" }
        },
        "slot_requirements": {
          "type": "object",
          "description": "Per-slot requirements (required?, frozen?, data-driven?). Keyed by slot id.",
          "additionalProperties": {
            "type": "object",
            "properties": {
              "required": { "type": "boolean", "default": true },
              "frozen": { "type": "boolean", "default": false, "description": "true for X2 (trust anchor)." },
              "data_source": { "type": "string", "description": "e.g. 'sweed_menu' for X4." }
            },
            "additionalProperties": true
          }
        }
      }
    },
    "component": {
      "type": "object",
      "description": "A frozen component contract. X2 (trust anchor cash/debit) is the canonical example; frozen components may not be edited without a page-dave -p 4 event (parent §7).",
      "required": ["component_id", "frozen"],
      "properties": {
        "component_id": { "type": "string", "minLength": 1 },
        "frozen": { "type": "boolean" },
        "approval_id": { "type": "string", "description": "asset/legal approval id backing this component's provenance." }
      },
      "additionalProperties": true
    },
    "slot_id": { "type": "string", "pattern": "^X[1-9][0-9]*$" }
  }
}
