{
  "schema": "freshlybaked.lp.bundle.v1",
  "bundle_id": "lpb_2026-06-10_140312_7f3a91",
  "sites": {
    "midtown": {
      "host": "midtown.freshlybaked.us",
      "purpose_max_variant": {
        "deliverance": 4,
        "recurse": 3,
        "tours": 2,
        "branding": 5,
        "compare": 5
      }
    },
    "bronx": {
      "host": "bronx.freshlybaked.us",
      "purpose_max_variant": {
        "deliverance": 4,
        "recurse": 3,
        "tours": 2,
        "branding": 5,
        "compare": 5
      }
    }
  },
  "families": {
    "weed-delivery-near-me": {
      "purpose": "deliverance",
      "slots": ["X1", "X2", "X3", "X4", "X5"],
      "slot_requirements": {
        "X1": { "required": true },
        "X2": { "required": true, "frozen": true },
        "X3": { "required": false },
        "X4": { "required": true, "data_source": "sweed_menu" },
        "X5": { "required": true }
      }
    }
  },
  "components": {
    "trust_anchor_cash_debit_v1": {
      "component_id": "trust_anchor_cash_debit_v1",
      "frozen": true,
      "approval_id": "legal_2026-05-01_x2"
    }
  }
}
